{
  "build_id": "safehavenrr-1786865873839",
  "client_id": "safehavenrr",
  "files": [
    {
      "bytes": 300,
      "owner": "website-bot",
      "path": "astro.config.mjs",
      "sha256": "b2ce0d66680d0bcb57b96af2d052fbf040f33dc3ca2ff12a79ff397f2b53040e"
    },
    {
      "bytes": 220577,
      "owner": "website-bot",
      "path": "package-lock.json",
      "sha256": "226d40690cc247a7857c4a78564153af0df6bb07996dc0d5f0b428aab5bea880"
    },
    {
      "bytes": 350,
      "owner": "website-bot",
      "path": "package.json",
      "sha256": "be81b2be7b995ec9d7fd30f32703989c14909f4ead36d70765836c779a8d69f8"
    },
    {
      "bytes": 78,
      "owner": "website-bot",
      "path": "public/robots.txt",
      "sha256": "ce5f6c88af72867c8be83fa6887f2273f0dd13457321b8c3391a564f27a83985"
    },
    {
      "bytes": 2405,
      "owner": "website-bot",
      "path": "scripts/lib.mjs",
      "sha256": "96a256140162ee5f4843c56ddb717d25b3b1d97a257f977e665774be6797ebea"
    },
    {
      "bytes": 1516,
      "owner": "website-bot",
      "path": "scripts/preflight.mjs",
      "sha256": "2a9f4c5a29e1dfe75c2074329d992c6f55badb898aa86944f8665a1e154ef3bc"
    },
    {
      "bytes": 2922,
      "owner": "website-bot",
      "path": "scripts/validation-framework.mjs",
      "sha256": "47a0ca5992064f9a17c81012d7f25dcaa39f31837e308f739f47d8b65c07464a"
    },
    {
      "bytes": 1611,
      "owner": "website-bot",
      "path": "scripts/verify-all.mjs",
      "sha256": "cb0381fdfe395c8b54f5de6bbd88cc73c4ef21d0f0902f4db62ceb999970220a"
    },
    {
      "bytes": 2933,
      "owner": "website-bot",
      "path": "scripts/verify-analytics.mjs",
      "sha256": "6f461f5412d3cb4795263e7930b038db52fc1ed6042b0958f4f726d29348ea43"
    },
    {
      "bytes": 1660,
      "owner": "website-bot",
      "path": "scripts/verify-build.mjs",
      "sha256": "571e84f6b29664af32940a48bded7c1658bd6673c9a1ee89769eed4cfbc713b8"
    },
    {
      "bytes": 3154,
      "owner": "website-bot",
      "path": "scripts/verify-crm.mjs",
      "sha256": "6791c59f94e781e6ea3d275b115545f69c0aefb2bb2ed96ba93932d05bc37263"
    },
    {
      "bytes": 2275,
      "owner": "website-bot",
      "path": "scripts/verify-form.mjs",
      "sha256": "2dedc52c4a0b5ff3c6e94b11f46ba4b4d2a7ae1ed5c204b7596ed18ab76d827c"
    },
    {
      "bytes": 4093,
      "owner": "website-bot",
      "path": "scripts/verify-rollback.mjs",
      "sha256": "cca4654454a271532b89a12a586c26a9218362ce08fbeb2a1719049d31addb37"
    },
    {
      "bytes": 5140,
      "owner": "website-bot",
      "path": "scripts/verify-seo.mjs",
      "sha256": "edc09a449ee69791c9bb4cea505b0daec01a3222daf95b8ce677785633af65ca"
    },
    {
      "bytes": 1725,
      "owner": "website-bot",
      "path": "scripts/verify-smoke.mjs",
      "sha256": "bfb73a763ae3c7527299b3ab4bf23e4601a0c0656f429fbd64833d516cdf4e85"
    },
    {
      "bytes": 2029,
      "owner": "website-bot",
      "path": "scripts/verify-source.mjs",
      "sha256": "f823c70ea63fa9621d5cbcecdb1cb7be12edade11bf73baa351da80ff4e98036"
    },
    {
      "bytes": 1184,
      "owner": "website-bot",
      "path": "src/components/LeadForm.astro",
      "sha256": "d6eb18a82d57e73a0f57730b0695242712695d99bd18bdc2d781ac3b62e9879c"
    },
    {
      "bytes": 534,
      "owner": "website-bot",
      "path": "src/components/SectionRegistry.ts",
      "sha256": "e7a6ef80ef16185f3bd6b8216ab0f457b9be437c463ea56de4d2b7f9a945756b"
    },
    {
      "bytes": 1232,
      "owner": "website-bot",
      "path": "src/components/SectionRenderer.astro",
      "sha256": "1d4a7ef9c5f0fe55e7e9c20baef24e1934b46ec10a181f2e53e54d0743601747"
    },
    {
      "bytes": 435,
      "owner": "website-bot",
      "path": "src/components/sections/AudiencePaths.astro",
      "sha256": "f9d6eb617cbe963b7978f0d41017cbdbc72b894c3380b560f55b13b3476abde4"
    },
    {
      "bytes": 435,
      "owner": "website-bot",
      "path": "src/components/sections/ComplianceNote.astro",
      "sha256": "9be00f4b6a48f6546662212e64d60db61a13bb61f97e9cbdccdecfe50ce4ec23"
    },
    {
      "bytes": 428,
      "owner": "website-bot",
      "path": "src/components/sections/Confirmation.astro",
      "sha256": "fe755bff374c2b00b673cdf875be24c775f03121a86510ee27920af9f4828cbc"
    },
    {
      "bytes": 718,
      "owner": "website-bot",
      "path": "src/components/sections/CtaBanner.astro",
      "sha256": "94ef93e3d4613915c63469224a6f82118d56966b202cb1dd7b63d42cf868b44f"
    },
    {
      "bytes": 418,
      "owner": "website-bot",
      "path": "src/components/sections/Faq.astro",
      "sha256": "dda52e755ad44d79530f6955e215f87a884f43035b08cfa2bd5fc73007caf3a4"
    },
    {
      "bytes": 1087,
      "owner": "website-bot",
      "path": "src/components/sections/Gallery.astro",
      "sha256": "53521ad8a2b2f99ffc8f917acc9dcabbf171299f1d191ea1fae6330afbd51e81"
    },
    {
      "bytes": 1427,
      "owner": "website-bot",
      "path": "src/components/sections/Hero.astro",
      "sha256": "50cfcf1c61cf73d4ec75ec104507d6e5d02cd4324865634074ea1fcbc624aeef"
    },
    {
      "bytes": 415,
      "owner": "website-bot",
      "path": "src/components/sections/Process.astro",
      "sha256": "45cdcbb41ba96647092c07b7cecb675c7545dc758267334f2d4da3d6638b6614"
    },
    {
      "bytes": 600,
      "owner": "website-bot",
      "path": "src/components/sections/ProseSection.astro",
      "sha256": "83532ddeac80dab4a242d03bbeb50002bf51eec2403e263a1cf9cb1d30a8c61a"
    },
    {
      "bytes": 431,
      "owner": "website-bot",
      "path": "src/components/sections/ServiceArea.astro",
      "sha256": "0e44820c14be9001f157b5adc98000741cd14b033fbae572c5e195711c4e4cdb"
    },
    {
      "bytes": 430,
      "owner": "website-bot",
      "path": "src/components/sections/TrustBar.astro",
      "sha256": "637a4f85060fa776b46cfcef87d3943bb0971034842a0b0bd51f9ebe4f917551"
    },
    {
      "bytes": 4153,
      "owner": "website-bot",
      "path": "src/layouts/BaseLayout.astro",
      "sha256": "4bf723c00cf1607527562108f6272b5497adaddb7ba39fdadea944f2fdd76425"
    },
    {
      "bytes": 12984,
      "owner": "website-bot",
      "path": "src/lib/siteConfig.ts",
      "sha256": "604f51af0a17e6b239ec55670bfc7ffb1f7afd8761eb0eb87d2ed774be5c956c"
    },
    {
      "bytes": 3352,
      "owner": "website-bot",
      "path": "src/pages/about/index.astro",
      "sha256": "cd0e12d5e3cec31f01712ceab0948fc10d7f1c5241735160f7ce26be0c5c7c1b"
    },
    {
      "bytes": 2282,
      "owner": "website-bot",
      "path": "src/pages/contact/index.astro",
      "sha256": "a1622fe7bac4d87b69dfa02d26dff15a72dbfb1e5be6a0f9cf605d3e8b1200df"
    },
    {
      "bytes": 6516,
      "owner": "website-bot",
      "path": "src/pages/faq/index.astro",
      "sha256": "f54e2eb44401746b42084368d593902707e71c72f2d559bf7c6ea2f8189fa4db"
    },
    {
      "bytes": 2400,
      "owner": "website-bot",
      "path": "src/pages/gallery/index.astro",
      "sha256": "a974f7fc5ee3eb344f77768e62276561644d20fb54ee0092b76ff500824b7d71"
    },
    {
      "bytes": 3930,
      "owner": "website-bot",
      "path": "src/pages/guides/how-long-roof-replacement-takes-charlotte/index.astro",
      "sha256": "3e7ce95a4ca7e1d055e0db657794fcd014f802ebb158ad63b1d3aeb7b7d18d96"
    },
    {
      "bytes": 4056,
      "owner": "website-bot",
      "path": "src/pages/guides/how-to-choose-roofing-contractor-charlotte/index.astro",
      "sha256": "00eef8a9bb18b15f2248dbfbc32ae2bbc19a3e47ed20c63ec0b1a2be5d57c293"
    },
    {
      "bytes": 3786,
      "owner": "website-bot",
      "path": "src/pages/guides/index.astro",
      "sha256": "3d8400d578e56a494aa2b2157d74e5d9ddc0ec29d1e71f0e9fad2555ae9189c2"
    },
    {
      "bytes": 3639,
      "owner": "website-bot",
      "path": "src/pages/guides/metal-roof-vs-shingles-charlotte/index.astro",
      "sha256": "a1ae8a32f541b4f556a2a91554adfff5755afd300b93fe7a7ec74cb1fb7a5567"
    },
    {
      "bytes": 3864,
      "owner": "website-bot",
      "path": "src/pages/guides/repair-or-replace-roof-charlotte/index.astro",
      "sha256": "2f2d63320bedf103a30250b5764e3802635920c39ccaffde643d83fcf01ced8b"
    },
    {
      "bytes": 4464,
      "owner": "website-bot",
      "path": "src/pages/guides/roof-replacement-cost-charlotte/index.astro",
      "sha256": "ecfcc273cbb0dfacd3dfa31d2258abed899d058d2181fae2ca912cfdf1394e64"
    },
    {
      "bytes": 4040,
      "owner": "website-bot",
      "path": "src/pages/guides/storm-damage-roof-repair-charlotte/index.astro",
      "sha256": "d1e758b0f11e442ce0c5d1983e91eb3e71a9fef0333c4c4a90dc58b7a5ddaff0"
    },
    {
      "bytes": 4799,
      "owner": "website-bot",
      "path": "src/pages/index.astro",
      "sha256": "913326d24eaedcd6616e23b06072c6015786003d4afc625463930eb533363ee2"
    },
    {
      "bytes": 3846,
      "owner": "website-bot",
      "path": "src/pages/insurance-claims/index.astro",
      "sha256": "a82ec355e256cbd41360f3b3811616ec79ea893f89147a55810a2bd4b034ba7f"
    },
    {
      "bytes": 2613,
      "owner": "website-bot",
      "path": "src/pages/privacy/index.astro",
      "sha256": "232a476de1bd1c096c0ae0c63c55336c7b4afbdccbf4eae3472c58c0e0d81c4d"
    },
    {
      "bytes": 3094,
      "owner": "website-bot",
      "path": "src/pages/service-areas/charlotte/index.astro",
      "sha256": "d4b7d6e4f782d8436add4017dcccd4fa574b1668e5a4eec87bd4b7496c20105c"
    },
    {
      "bytes": 3756,
      "owner": "website-bot",
      "path": "src/pages/service-areas/index.astro",
      "sha256": "a5f3cd9141908ea7150fba95b92c0c7655a5f2d3af3efaea76b1fbf1f9be728e"
    },
    {
      "bytes": 3921,
      "owner": "website-bot",
      "path": "src/pages/services/asphalt-shingles/index.astro",
      "sha256": "88bb69677a4460d8e1462767f99b5e9c0391279550ff8bc963a5b686b0af98bd"
    },
    {
      "bytes": 3724,
      "owner": "website-bot",
      "path": "src/pages/services/flat-roofing/index.astro",